{
  "cited_by": [
    "LIB-IDEA-0001.r1"
  ],
  "context_after": 1,
  "context_before": 1,
  "created_in": "TXN-000013",
  "format_version": "1",
  "id": "WIN-00013",
  "instance_id": "alm.synthetic.example",
  "kind": "evidence-window",
  "log_id": "LOG-EXAMPLE",
  "message_end": 13,
  "message_start": 13,
  "scope_id": "PROJECT-LIBRARY",
  "source_digest": "3a879614b166237db0f2137c0c9a8cbc1cd467411361792c9e451da236abcc23"
}
